<xs:schema attributeFormDefault="unqualified" elementFormDefault="qualified" xmlns:xs="http://www.w3.org/2001/XMLSchema">
	<xs:element name="list">
		<xs:complexType>
			<xs:sequence>
				<xs:element name="reward" maxOccurs="unbounded" minOccurs="0">
					<xs:complexType>
						<xs:sequence>
							<xs:element name="items">
								<xs:complexType>
									<xs:sequence>
										<xs:element name="item" maxOccurs="unbounded" minOccurs="0">
											<xs:complexType>
												<xs:simpleContent>
													<xs:extension base="xs:string">
														<xs:attribute type="xs:int" name="id" use="optional" />
														<xs:attribute type="xs:int" name="count" use="optional" />
														<xs:attribute type="xs:double" name="chance" use="optional" />
														<xs:attribute type="xs:double" name="lotteryChance" use="optional" />
													</xs:extension>
												</xs:simpleContent>
											</xs:complexType>
										</xs:element>
									</xs:sequence>
								</xs:complexType>
							</xs:element>
						</xs:sequence>
						<xs:attribute type="xs:int" name="from" use="optional" />
						<xs:attribute type="xs:int" name="to" use="optional" />
					</xs:complexType>
				</xs:element>
			</xs:sequence>
			<xs:attribute type="xs:string" name="easyMode" />
			<xs:attribute type="xs:int" name="minLevel" />
			<xs:attribute type="xs:int" name="id" />
			<xs:attribute type="xs:int" name="count" />
			<xs:attribute type="xs:string" name="mailSubject" />
			<xs:attribute type="xs:string" name="mailContent" />
		</xs:complexType>
	</xs:element>
</xs:schema>
